{"contract": 1, "generation": 5, "refused": "secrets.toml at world/Ashwake/password: 'horn' is too short", "worlds": {"Meadowfold": {"published": 4, "pending": {"generation": 5, "waits_for": "an empty world"}, "state": "running", "report": {"contract": 1, "generation": 4, "world": "Meadowfold", "state": "running", "game_build": "25909431", "objects": 48113, "players": 2}, "report_age_s": 1}, "Ashwake": {"published": 4, "pending": {"generation": 5, "waits_for": "vhd apply"}, "state": "running", "report": {"contract": 1, "generation": 4, "world": "Ashwake", "state": "running", "game_build": "25909431", "objects": 9120, "players": 0}, "report_age_s": 3}}}
